{"artifact":{"architecture":"x86_64","format":"canonical-ustar-v1","os":"linux","version":"cogs.stage2-prebuilt-rootfs/v1"},"authority":"authenticated-static-control-only","producer":{"input_contract_sha256":"fe524cc5caafab7f6bb10ef9ebcac40903c1b1bdd60e8ebbf21919bfa788a341","package_manifest_sha256":"e46faeaa4148829e7ad53dac34ac6bcf9f0ca0bb9d29067f750c983f060e8068","provenance_sha256":"a95f2ab29070f8fb35c01549bf2bb3f2370d13ceafee2ce8845be79f1c867c0b","publication_receipt_sha256":"1d38b42ad1cc031a20d53e69d8e33a2b7f13b5dea4242283df5f6a2536528de1","qualification_receipt_sha256":"512eecc040cf6e7a7c8ab927cbbffe5c8ff92b4a09b982dd77f0e2f41d7d3c84","revision":"5bced6bdc54756761f28a393970301b9b24341cc","source_manifest_sha256":"dd0ee3095d27cf9e14c3014558a6628d5f2f9b28eb75e00ddbf39a064487a954"},"registry":{"host":"ghcr.io","layer_digest":"41951eee6ee10211fa716962dd6e2641c319a816b89d0fc31fe114872addc397","layer_media_type":"application/vnd.cogs.stage2.rootfs.v1.tar","layer_size":136905728,"manifest_digest":"f80a3eafb00a184fa0899014c91401d7d5f06d757b29f38562070d0b5dab2a67","manifest_media_type":"application/vnd.oci.image.manifest.v1+json","repository":"nenb/cogs/stage2-rootfs"},"rootfs":{"entry_count":4353,"manifest_sha256":"59ae5c5840fffca4ec24f4d720bca7a3f1ecb85e2950d8a7a3db7a3315c321d1","manifest_size":1049443,"metadata_sha256":"8bb789127187f3687d1452a4690c4b700fd99ad9e9c97469b726541fad972506","metadata_size":444,"source_date_epoch":1782172800,"ustar_sha256":"41951eee6ee10211fa716962dd6e2641c319a816b89d0fc31fe114872addc397","ustar_size":136905728},"version":"cogs.stage2-prebuilt-rootfs-descriptor/v1"}
